,content,engine,positions,pretty_url,pubdate,score,title,url,searchvalue,searchquery,ResponseCategory,country,contentDate,Date
89,"Vogelweh Elementary School and all other Department of Defense schools in Germany, Belgium and the Netherlands will be closed starting ...",startpage,[10],https://www.stripes.com/news/europe/ne[...]ose-over-coronavirus-concerns-1.622290,2020-03-13 00:00:00,0.1,Nearly all military schools in Europe close over coronavirus ...,https://www.stripes.com/news/europe/nearly-all-military-schools-in-europe-close-over-coronavirus-concerns-1.622290,schools+shut,germany+schools+shut,schools,germany,"Vogelweh Elementary School and all other Department of Defense schools in Germany, Belgium and the Netherlands will be closed starting",2020-03-13 00:00:00
90,13 Mar 2020 ...,startpage,[1],https://www.thelocal.de/20200313/coron[...]aria-and-saarland-to-close-all-schools,,1.0,UPDATE: All German states announce school and Kita closures,https://www.thelocal.de/20200313/coronavirus-bavaria-and-saarland-to-close-all-schools,schools+closed,germany+schools+closed,schools,germany,2020-03-13,2020-03-13 00:00:00
91,12 Mar 2020 ...,startpage,[2],https://www.thelocal.de/20200312/schoo[...]ronavirus-is-affecting-life-in-germany,,0.5,School closures and no partying: How coronavirus is affecting life in ...,https://www.thelocal.de/20200312/school-closures-and-events-axed-how-coronavirus-is-affecting-life-in-germany,schools+closed,germany+schools+closed,schools,germany,2020-03-12,2020-03-12 00:00:00
92,"BERLIN (Reuters) - Schools and kindergartens will be shut in most German states until after the Easter holiday in April, a measure designed to ...",startpage,[3],https://www.usnews.com/news/world/arti[...]hools-to-slow-coronavirus-epidemic-dpa,2020-03-13 00:00:00,0.3333333333333333,Germany to Shut Most Schools to Slow Coronavirus Spread | World ...,https://www.usnews.com/news/world/articles/2020-03-13/german-state-of-bavaria-closes-schools-to-slow-coronavirus-epidemic-dpa,schools+closed,germany+schools+closed,schools,germany,"BERLIN (Reuters) - Schools and kindergartens will be shut in most German states until after the Easter holiday in April, a measure designed to",2020-03-13 00:00:00
93,14 Mar 2020 ...,startpage,[4],https://www.iamexpat.de/expat-info/ger[...]-are-parents-germany-allowed-stay-home,,0.25,Schools closed: Are parents in Germany allowed to stay home?,https://www.iamexpat.de/expat-info/german-expat-news/schools-closed-are-parents-germany-allowed-stay-home,schools+closed,germany+schools+closed,schools,germany,2020-03-14,2020-03-14 00:00:00
94,"The number of children, youth and adults not attending schools or universities because of COVID-19 is soaring. Governments all around the world have closed ...",startpage,[5],https://en.unesco.org/themes/education[...]mergencies/coronavirus-school-closures,,0.2,School closures caused by Coronavirus (Covid-19) - Unesco,https://en.unesco.org/themes/education-emergencies/coronavirus-school-closures,schools+closed,germany+schools+closed,schools,germany,"The number of children, youth and adults not attending schools or universities because of COVID-19 is soaring. Governments all around the world have closed",
95,13 Mar 2020 ...,startpage,[6],https://www.express.co.uk/news/world/1[...]ls-closed-latest-news-cases-death-toll,,0.16666666666666666,School closures: Scared Brits urge UK to follow Germany's lead on ...,https://www.express.co.uk/news/world/1254637/School-closures-Britain-UK-Germany-shutting-schools-closed-latest-news-cases-death-toll,schools+closed,germany+schools+closed,schools,germany,2020-03-13,2020-03-13 00:00:00
96,"Schools and kindergartens will be shut in most German states until after the Easter holiday in April, a measure designed to slow the spread of ...",startpage,[7],https://www.reuters.com/article/us-hea[...]coronavirus-epidemic-dpa-idUSKBN2100SA,2020-03-13 00:00:00,0.14285714285714285,Germany to shut most schools to slow coronavirus spread - Reuters,https://www.reuters.com/article/us-health-coronavirus-germany-schools/german-state-of-bavaria-closes-schools-to-slow-coronavirus-epidemic-dpa-idUSKBN2100SA,schools+closed,germany+schools+closed,schools,germany,"Schools and kindergartens will be shut in most German states until after the Easter holiday in April, a measure designed to slow the spread of",2020-03-13 00:00:00
97,"School Closures in Germany German States Move To Close Educational and Daycare Facilities. First Saarland and Bavaria, followed by Berlin ...",startpage,[8],https://www.spiegel.de/international/g[...]a-e9c13296-002b-484b-88bc-e14ea295ff10,2020-03-17 00:00:00,0.125,School Closures in Germany: German States Move To Close ...,https://www.spiegel.de/international/germany/germany-states-move-to-close-educational-and-daycare-facilities-a-e9c13296-002b-484b-88bc-e14ea295ff10,schools+closed,germany+schools+closed,schools,germany,"School Closures in Germany German States Move To Close Educational and Daycare Facilities. First Saarland and Bavaria, followed by Berlin",2020-03-17 00:00:00
98,12 Mar 2020 ...,startpage,[9],https://www.theguardian.com/world/2020[...]ontainment-measures-vary-across-europe,,0.1111111111111111,How do coronavirus containment measures vary across Europe?,https://www.theguardian.com/world/2020/mar/12/how-do-coronavirus-containment-measures-vary-across-europe,schools+closed,germany+schools+closed,schools,germany,2020-03-12,2020-03-12 00:00:00
99,"Vogelweh Elementary School and all other Department of Defense schools in Germany, Belgium and the Netherlands will be closed starting ...",startpage,[10],https://www.stripes.com/news/europe/ne[...]ose-over-coronavirus-concerns-1.622290,2020-03-13 00:00:00,0.1,Nearly all military schools in Europe close over coronavirus ...,https://www.stripes.com/news/europe/nearly-all-military-schools-in-europe-close-over-coronavirus-concerns-1.622290,schools+closed,germany+schools+closed,schools,germany,"Vogelweh Elementary School and all other Department of Defense schools in Germany, Belgium and the Netherlands will be closed starting",2020-03-13 00:00:00
100,"The closures in Germany will include restaurants, bars, clubs, theaters and museums. The world's stock markets continue downward trajectory.",startpage,[1],https://www.dw.com/en/coronavirus-late[...]-shops-bars-and-restaurants/a-52788195,2020-03-16 00:00:00,1.0,"Coronavirus latest: Germany to close all non-essential shops, bars ...",https://www.dw.com/en/coronavirus-latest-germany-to-close-all-non-essential-shops-bars-and-restaurants/a-52788195,bars+restaurants,germany+bars+restaurants,restaurants,germany,"The closures in Germany will include restaurants, bars, clubs, theaters and museums. The world's stock markets continue downward trajectory.",2020-03-16 00:00:00
101,"Top Germany Bars & Clubs: See reviews and photos of bars & clubs in Germany, Europe on Tripadvisor.",startpage,[2],https://www.tripadvisor.com/Attraction[...]187275-Activities-c20-t99-Germany.html,,0.5,THE 5 BEST Germany Bars & Clubs (with Photos) - Tripadvisor,https://www.tripadvisor.com/Attractions-g187275-Activities-c20-t99-Germany.html,bars+restaurants,germany+bars+restaurants,restaurants,germany,"Top Germany Bars & Clubs: See reviews and photos of bars & clubs in Germany, Europe on Tripadvisor.",
102,"Beer halls, bars and restaurants in Germany: readers' travel tips. Fancy some fruity beer with a side of pretzels or a glass of white wine with ...",startpage,[3],https://www.theguardian.com/travel/201[...]rhauses-restaurant-readers-travel-tips,2016-07-21 00:00:00,0.3333333333333333,"Beer halls, bars and restaurants in Germany: readers' travel tips ...",https://www.theguardian.com/travel/2016/jul/21/germany-bars-bierhauses-restaurant-readers-travel-tips,bars+restaurants,germany+bars+restaurants,restaurants,germany,"Beer halls, bars and restaurants in Germany: readers' travel tips. Fancy some fruity beer with a side of pretzels or a glass of white wine with",2016-07-21 00:00:00
103,The best restaurants and bars in Berlin. Browse the restaurants and bars in Berlin. Bar Immertreu. Bar. Bar Immertreu. Swanky classic lounge. Bar. Becketts Kopf.,startpage,[4],https://www.theworlds50best.com/discovery/sitemap/germany/berlin,,0.25,"The best Restaurants and Bars in Berlin, Germany 2020 | 50Best ...",https://www.theworlds50best.com/discovery/sitemap/germany/berlin,bars+restaurants,germany+bars+restaurants,restaurants,germany,The best restaurants and bars in Berlin. Browse the restaurants and bars in Berlin. Bar Immertreu. Bar. Bar Immertreu. Swanky classic lounge. Bar. Becketts Kopf.,
104,The German side posted the names of 86 food and drinks outlets during a virtual football night on Sunday on the clubs website.,startpage,[5],https://www.thejakartapost.com/news/20[...]e-70000-euros-to-bars-restaurants.html,2020-03-24 00:36:47,0.2,"Dortmund fans donate 70,000 euros to bars, restaurants - Sports ...",https://www.thejakartapost.com/news/2020/03/23/dortmund-fans-donate-70000-euros-to-bars-restaurants.html,bars+restaurants,germany+bars+restaurants,restaurants,germany,The German side posted the names of 86 food and drinks outlets during a virtual football night on Sunday on the clubs website.,2020-03-24 00:36:47
105,"Berlin and Cologne are to close all bars, clubs, cinemas, theaters and concert halls with immediate effect as Germany ramps up its efforts to slow the ... Restaurants and pubs that serve food could remain open, as in Berlin.",startpage,[6],https://www.reuters.com/article/us-hea[...]ens-coronavirus-response-idUSKBN2110LS,2020-03-14 00:00:00,0.16666666666666666,"Berlin joins Cologne in closing bars, clubs as Germany toughens ...",https://www.reuters.com/article/us-health-coronavirus-germany/berlin-joins-cologne-in-closing-bars-clubs-as-germany-toughens-coronavirus-response-idUSKBN2110LS,bars+restaurants,germany+bars+restaurants,restaurants,germany,"Berlin and Cologne are to close all bars, clubs, cinemas, theaters and concert halls with immediate effect as Germany ramps up its efforts to slow the Restaurants and pubs that serve food could remain open, as in Berlin.",2020-03-14 00:00:00
106,13 Mar 2020 ...,startpage,[7],https://www.thelocal.de/20200313/coron[...]closed-as-public-transport-scaled-back,,0.14285714285714285,"Coronavirus: Berlin orders closure of bars, museums and gyms",https://www.thelocal.de/20200313/coronavirus-berlin-bars-and-clubs-to-be-closed-as-public-transport-scaled-back,bars+restaurants,germany+bars+restaurants,restaurants,germany,2020-03-13,2020-03-13 00:00:00
107,"The German laws regulating alcohol use and sale are mostly focused on youth protection. ... stores generally check minors for their identity card. The law is less thoroughly enforced in many bars and restaurants, but this can vary by location.",startpage,[8],https://en.wikipedia.org/wiki/Alcohol_laws_in_Germany,,0.125,Alcohol laws in Germany - Wikipedia,https://en.wikipedia.org/wiki/Alcohol_laws_in_Germany,bars+restaurants,germany+bars+restaurants,restaurants,germany,"The German laws regulating alcohol use and sale are mostly focused on youth protection. stores generally check minors for their identity card. The law is less thoroughly enforced in many bars and restaurants, but this can vary by location.",
108,You don't have to be in Berlin or Munich to enjoy great German food and drinks. Here are the best German bars and restaurants around the ...,startpage,[9],https://edition.cnn.com/travel/article[...]est-german-bars-restaurants/index.html,2017-10-10 00:00:00,0.1111111111111111,Best German bars and restaurants around the world. | CNN Travel,https://edition.cnn.com/travel/article/best-german-bars-restaurants/index.html,bars+restaurants,germany+bars+restaurants,restaurants,germany,You don't have to be in Berlin or Munich to enjoy great German food and drinks. Here are the best German bars and restaurants around the,2017-10-10 00:00:00
109,From an illustrated travel guide to a handsome and historic city near the border of Germany and the Netherlands at Durant and Cheryl Imboden's ...,startpage,[10],https://europeforvisitors.com/germany/muenster/muenster-restaurants.htm,,0.1,Münster Restaurants and Bars - Europe for Visitors,https://europeforvisitors.com/germany/muenster/muenster-restaurants.htm,bars+restaurants,germany+bars+restaurants,restaurants,germany,From an illustrated travel guide to a handsome and historic city near the border of Germany and the Netherlands at Durant and Cheryl Imboden's,
110,"The closures in Germany will include restaurants, bars, clubs, theaters ... crackdown is in the offing, with non-essential shops set to be closed.",startpage,[1],https://www.dw.com/en/coronavirus-late[...]-shops-bars-and-restaurants/a-52788195,2020-03-16 00:00:00,1.0,"Coronavirus latest: Germany to close all non-essential shops, bars ...",https://www.dw.com/en/coronavirus-latest-germany-to-close-all-non-essential-shops-bars-and-restaurants/a-52788195,closed+bars+restaurants,germany+closed+bars+restaurants,restaurants,germany,"The closures in Germany will include restaurants, bars, clubs, theaters crackdown is in the offing, with non-essential shops set to be closed.",2020-03-16 00:00:00
111,"In yet another attempt to slow down the spread of the Coronavirus, Germany announced new measures. Chancellor Angela Merkel said the ...",startpage,[2],https://berlinspectator.com/2020/03/16[...]churches-bars-pubs-brothels-casinos-1/,2020-03-16 00:00:00,0.5,"Corona Crisis: Germany Closes Shops, Churches, Bars, Pubs ...",https://berlinspectator.com/2020/03/16/corona-crisis-germany-closes-shops-churches-bars-pubs-brothels-casinos-1/,closed+bars+restaurants,germany+closed+bars+restaurants,restaurants,germany,"In yet another attempt to slow down the spread of the Coronavirus, Germany announced new measures. Chancellor Angela Merkel said the",2020-03-16 00:00:00
112,13 Mar 2020 ...,startpage,[3],https://www.thelocal.de/20200313/coron[...]closed-as-public-transport-scaled-back,,0.3333333333333333,"Coronavirus: Berlin orders closure of bars, museums and gyms",https://www.thelocal.de/20200313/coronavirus-berlin-bars-and-clubs-to-be-closed-as-public-transport-scaled-back,closed+bars+restaurants,germany+closed+bars+restaurants,restaurants,germany,2020-03-13,2020-03-13 00:00:00
113,15 Mar 2020 ...,startpage,[4],https://www.bbc.co.uk/news/live/world-51903319,,0.25,"Coronavirus updates: France 'at war', says Macron - BBC News",https://www.bbc.co.uk/news/live/world-51903319,closed+bars+restaurants,germany+closed+bars+restaurants,restaurants,germany,2020-03-15,2020-03-15 00:00:00
114,Germany Switzerland S. Korea France USA Spain China Iran Italy 0 10 20 30 ... France closes bars and restaurants... but election goes ahead.,startpage,[5],https://www.euronews.com/2020/03/09/co[...]omes-most-affected-country-after-china,2020-03-14 00:00:00,0.2,Coronavirus: Spain declares state of emergency as France shuts ...,https://www.euronews.com/2020/03/09/coronavirus-italy-becomes-most-affected-country-after-china,closed+bars+restaurants,germany+closed+bars+restaurants,restaurants,germany,Germany Switzerland S. Korea France USA Spain China Iran Italy 0 10 20 30 France closes bars and restaurants... but election goes ahead.,2020-03-14 00:00:00
115,17 Mar 2020 ...,startpage,[6],https://www.bbc.com/news/world-europe-51918596,,0.16666666666666666,Europe plans full border closure in virus battle,https://www.bbc.com/news/world-europe-51918596,closed+bars+restaurants,germany+closed+bars+restaurants,restaurants,germany,2020-03-17,2020-03-17 00:00:00
116,16 Mar 2020 ...,startpage,[7],https://www.bbc.com/news/world-europe-51905129,,0.14285714285714285,Germany closes borders to try to slow virus,https://www.bbc.com/news/world-europe-51905129,closed+bars+restaurants,germany+closed+bars+restaurants,restaurants,germany,2020-03-16,2020-03-16 00:00:00
117,"Coronavirus - Denmark closes border - tourists banned ... If you are headed to Germany for now you will encounter little in the way of travel ... It has already shut schools, bars, cafes, shopping malls, theatres, cinemas, ...",startpage,[8],https://www.forbes.com/sites/tamarathi[...]avirus-europe-closes-borders-tourists/,2020-03-14 00:00:00,0.125,Coronavirus: Some Of These 24 European Countries Have Closed ...,https://www.forbes.com/sites/tamarathiessen/2020/03/14/coronavirus-europe-closes-borders-tourists/,closed+bars+restaurants,germany+closed+bars+restaurants,restaurants,germany,"Coronavirus - Denmark closes border - tourists banned If you are headed to Germany for now you will encounter little in the way of travel It has already shut schools, bars, cafes, shopping malls, theatres, cinemas,",2020-03-14 00:00:00
118,12 Mar 2020 ...,startpage,[9],https://www.theguardian.com/world/2020[...]ontainment-measures-vary-across-europe,,0.1111111111111111,How do coronavirus containment measures vary across Europe?,https://www.theguardian.com/world/2020/mar/12/how-do-coronavirus-containment-measures-vary-across-europe,closed+bars+restaurants,germany+closed+bars+restaurants,restaurants,germany,2020-03-12,2020-03-12 00:00:00
119,"People stand in front of a closed cinema as the city are to close all bars, clubs, cinemas, theatres and concert halls with immediate effect as ...",startpage,[10],https://www.usnews.com/news/world/arti[...]italy-switzerland-austria-germany-says,2020-03-14 00:00:00,0.1,"Berlin Joins Cologne in Closing Bars, Clubs as Germany Toughens ...",https://www.usnews.com/news/world/articles/2020-03-14/self-isolate-if-youre-returning-from-italy-switzerland-austria-germany-says,closed+bars+restaurants,germany+closed+bars+restaurants,restaurants,germany,"People stand in front of a closed cinema as the city are to close all bars, clubs, cinemas, theatres and concert halls with immediate effect as",2020-03-14 00:00:00
120,Personal Liability Advice; Advisory/Restructuring Services. OPTIONS FOR DISSOLVING/WINDING UP A GERMAN COMPANY? VOLUNTARY CLOSURE OF ...,startpage,[1],https://www.closeaeuropeancompany.com/germany/,,1.0,How To Close A Company In Germany - Close a European Company,https://www.closeaeuropeancompany.com/germany/,Business+close,germany+Business+close,Business,germany,Personal Liability Advice; Advisory/Restructuring Services. OPTIONS FOR DISSOLVING/WINDING UP A GERMAN COMPANY? VOLUNTARY CLOSURE OF,
121,"The closures in Germany will include restaurants, bars, clubs, theaters ... 12:48 Stena Line, a Swedish ferry company, said it will cut 950 jobs in ...",startpage,[2],https://www.dw.com/en/coronavirus-late[...]-shops-bars-and-restaurants/a-52788195,2020-03-16 00:00:00,0.5,"Coronavirus latest: Germany to close all non-essential shops, bars ...",https://www.dw.com/en/coronavirus-latest-germany-to-close-all-non-essential-shops-bars-and-restaurants/a-52788195,Business+close,germany+Business+close,Business,germany,"The closures in Germany will include restaurants, bars, clubs, theaters 12:48 Stena Line, a Swedish ferry company, said it will cut 950 jobs in",2020-03-16 00:00:00
122,16 Mar 2020 ...,startpage,[3],https://www.dailymail.co.uk/news/artic[...]s-new-rules-close-essential-shops.html,,0.3333333333333333,Coronavirus Germany: All but banks and essential shops closed,https://www.dailymail.co.uk/news/article-8117883/Germany-agrees-new-rules-close-essential-shops.html,Business+close,germany+Business+close,Business,germany,2020-03-16,2020-03-16 00:00:00
123,"Organizations in this hub have their headquarters located in Germany, Europe; notable events and people located in Germany are also included. This list of ...",startpage,[4],https://www.crunchbase.com/hub/closed-germany-companies,,0.25,List of top Closed Germany Companies | Crunchbase,https://www.crunchbase.com/hub/closed-germany-companies,Business+close,germany+Business+close,Business,germany,"Organizations in this hub have their headquarters located in Germany, Europe; notable events and people located in Germany are also included. This list of",
124,6 days ago ...,startpage,[5],https://www.businessoffashion.com/arti[...]rs-plead-for-state-aid-as-stores-close,,0.2,German Retailers Plead for State Aid as Stores Close,https://www.businessoffashion.com/articles/news-analysis/german-retailers-plead-for-state-aid-as-stores-close,Business+close,germany+Business+close,Business,germany,2020-03-20,2020-03-20 00:00:00
125,"Find out about the opening and closing times and days of companies, banks and public administration offices : See the list of bank holidays, times when ...",startpage,[6],https://www.nordeatrade.com/en/explore-new-market/germany/opening-hours,,0.16666666666666666,Opening hours and bank holidays in Germany - Business ...,https://www.nordeatrade.com/en/explore-new-market/germany/opening-hours,Business+close,germany+Business+close,Business,germany,"Find out about the opening and closing times and days of companies, banks and public administration offices : See the list of bank holidays, times when",
126,"Throughout the year, apart from Festivals, businesses are open at the following hours: Offices: Mondays to Fridays: 09:00 - 18:00 (with a 1 hour lunch break)",startpage,[7],http://www.worldwide-tax.com/germany/gerbusiness.asp,,0.14285714285714285,Germany Business Opening Hours - The WorldWide-Tax.Com,http://www.worldwide-tax.com/germany/gerbusiness.asp,Business+close,germany+Business+close,Business,germany,"Throughout the year, apart from Festivals, businesses are open at the following hours: Offices: Mondays to Fridays: 09:00 - 18:00 (with a 1 hour lunch break)",
127,Germany's manufacturing slump is dragging the economy closer to ... Business expectations in Europe's largest economy fell to the lowest in a ...,startpage,[8],https://www.bloomberg.com/news/article[...]t-stabilizes-but-expectations-are-dire,2019-09-24 00:00:00,0.125,Manufacturing Slump Drags Germany Ever Closer to a Recession ...,https://www.bloomberg.com/news/articles/2019-09-24/german-business-sentiment-stabilizes-but-expectations-are-dire,Business+close,germany+Business+close,Business,germany,Germany's manufacturing slump is dragging the economy closer to Business expectations in Europe's largest economy fell to the lowest in a,2019-09-24 00:00:00
128,"Many shops and businesses are also closed on Carnival Rose Monday (Cologne and Rhine region), Christmas Eve and New Year's Eve although these are not ...",startpage,[9],https://businessculture.org/western-eu[...]-germany/work-life-balance-in-germany/,,0.1111111111111111,Work life balance in Germany: national holidays and working hours,https://businessculture.org/western-europe/business-culture-in-germany/work-life-balance-in-germany/,Business+close,germany+Business+close,Business,germany,"Many shops and businesses are also closed on Carnival Rose Monday (Cologne and Rhine region), Christmas Eve and New Year's Eve although these are not",
129,German business culture. Did you know about business culture in Germany? Watch this video animation to find out some interesting facts: Business Culture in ...,startpage,[10],https://businessculture.org/western-europe/business-culture-in-germany/,,0.1,"Business culture in Germany: international business, xenophobia ...",https://businessculture.org/western-europe/business-culture-in-germany/,Business+close,germany+Business+close,Business,germany,German business culture. Did you know about business culture in Germany? Watch this video animation to find out some interesting facts: Business Culture in,
130,"14 hours ago ... German Business Outlook Collapses With Economy Largely Shut Down. By. Piotr Skolimowski. March 25, 2020, 2:08 AM PDT.",startpage,[1],https://www.bloomberg.com/news/article[...]llapses-with-economy-largely-shut-down,,1.0,German Business Outlook Collapses With Economy Largely Shut ...,https://www.bloomberg.com/news/articles/2020-03-25/german-business-outlook-collapses-with-economy-largely-shut-down,Business+shut+down,germany+Business+shut+down,Business,germany,2020-03-25,2020-03-25 00:00:00
131,"As restaurants and other services shut down on Monday, the government ... Bridging loans for small businesses, huge health spend boost.",startpage,[2],https://www.dw.com/en/coronavirus-germ[...]-costs-of-economic-shutdown/a-52890813,2020-03-24 00:36:52,0.5,Coronavirus: Germany counts costs of economic shutdown | DW ...,https://www.dw.com/en/coronavirus-germany-counts-costs-of-economic-shutdown/a-52890813,Business+shut+down,germany+Business+shut+down,Business,germany,"As restaurants and other services shut down on Monday, the government Bridging loans for small businesses, huge health spend boost.",2020-03-24 00:36:52
132,"Increasingly in Germany, businesses have been encouraging employees to stay away from the office, with a recent poll of more than 700 ...",startpage,[3],https://www.dw.com/en/coronavirus-begi[...]-public-life-across-germany/a-52743358,2020-03-12 00:00:00,0.3333333333333333,Coronavirus begins shutting down public life across Germany | DW ...,https://www.dw.com/en/coronavirus-begins-shutting-down-public-life-across-germany/a-52743358,Business+shut+down,germany+Business+shut+down,Business,germany,"Increasingly in Germany, businesses have been encouraging employees to stay away from the office, with a recent poll of more than 700",2020-03-12 00:00:00
