,content,engine,positions,pretty_url,pubdate,score,title,url,searchvalue,searchquery,ResponseCategory,country,contentDate,Date
43,"Any country or area may restrict travel without notice. If you live in the UK and are currently travelling abroad, you are strongly advised to return now, where and ...",startpage,[4],https://www.gov.uk/foreign-travel-advice/germany,,0.25,Germany travel advice - GOV.UK,https://www.gov.uk/foreign-travel-advice/germany,travel+restrictions,germany+travel+restrictions,boarders,germany,"Any country or area may restrict travel without notice. If you live in the UK and are currently travelling abroad, you are strongly advised to return now, where and",
44,"Entry: travel restrictions and border controls. Germany has introduced travel restrictions for entries from outside the Schengen area on March 17, ...",startpage,[5],https://www.auswaertiges-amt.de/en/coronavirus/2317268,2020-03-23 00:36:38,0.2,Coronavirus and entry restrictions: 4 things travelers to Germany ...,https://www.auswaertiges-amt.de/en/coronavirus/2317268,travel+restrictions,germany+travel+restrictions,boarders,germany,"Entry: travel restrictions and border controls. Germany has introduced travel restrictions for entries from outside the Schengen area on March 17,",2020-03-23 00:36:38
45,"Information and developments from the German Federal Ministry of ... restrictions in international air and other travel, worldwide restrictions on ...",startpage,[6],https://www.bundesgesundheitsministerium.de/en/press/2020/coronavirus.html,2020-03-18 00:00:00,0.16666666666666666,Coronavirus Disease (COVID-19) | Current Status | FAQ,https://www.bundesgesundheitsministerium.de/en/press/2020/coronavirus.html,travel+restrictions,germany+travel+restrictions,boarders,germany,"Information and developments from the German Federal Ministry of restrictions in international air and other travel, worldwide restrictions on",2020-03-18 00:00:00
46,"Many airports are closing, preventing flights from leaving. Exit bans are becoming more frequent. New restrictions may be imposed with little warning. Your travel ...",startpage,[7],https://travel.gc.ca/destinations/germany,,0.14285714285714285,Travel advice and advisories for Germany,https://travel.gc.ca/destinations/germany,travel+restrictions,germany+travel+restrictions,boarders,germany,"Many airports are closing, preventing flights from leaving. Exit bans are becoming more frequent. New restrictions may be imposed with little warning. Your travel",
47,16 Mar 2020 ...,startpage,[8],https://www.bbc.com/news/world-europe-51905129,,0.125,Germany closes borders to try to slow virus,https://www.bbc.com/news/world-europe-51905129,travel+restrictions,germany+travel+restrictions,boarders,germany,2020-03-16,2020-03-16 00:00:00
48,"Some other countries have imposed travel restrictions, including a ban on entry or quarantine on arrival, for travellers from Germany. We now advise you to:.",startpage,[9],https://www.smartraveller.gov.au/destinations/europe/germany,,0.1111111111111111,Germany Travel Advice & Safety | Smartraveller,https://www.smartraveller.gov.au/destinations/europe/germany,travel+restrictions,germany+travel+restrictions,boarders,germany,"Some other countries have imposed travel restrictions, including a ban on entry or quarantine on arrival, for travellers from Germany. We now advise you to:.",
49,"On the same date, India also mandated 14-day quarantine for citizens returning from seven countries: China, France, Germany, Iran, Italy, South Korea and Spain.",startpage,[10],https://en.wikipedia.org/wiki/Travel_r[...]e_2019%E2%80%9320_coronavirus_pandemic,,0.1,Travel restrictions related to the 2019–20 coronavirus pandemic ...,https://en.wikipedia.org/wiki/Travel_restrictions_related_to_the_2019%E2%80%9320_coronavirus_pandemic,travel+restrictions,germany+travel+restrictions,boarders,germany,"On the same date, India also mandated 14-day quarantine for citizens returning from seven countries: China, France, Germany, Iran, Italy, South Korea and Spain.",
50,18 Mar 2020 ...,startpage,[1],https://www.politico.eu/article/german[...]borders-to-eu-travelers-minister-says/,,1.0,"Germany expands border controls for EU travelers, minister says",https://www.politico.eu/article/germany-closing-borders-to-eu-travelers-minister-says/,closes+boarders,germany+closes+boarders,boarders,germany,2020-03-18,2020-03-18 00:00:00
51,15 Mar 2020 ...,startpage,[2],https://www.politico.eu/article/german[...]artially-close-borders-with-neighbors/,,0.5,Germany to partially close borders with neighbors,https://www.politico.eu/article/germany-to-partially-close-borders-with-neighbors/,closes+boarders,germany+closes+boarders,boarders,germany,2020-03-15,2020-03-15 00:00:00
52,German officials announced Wednesday that the country will ban travel from European Union (EU) countries as part of the country's efforts to ...,startpage,[3],https://thehill.com/policy/internation[...]osing-its-borders-to-travelers-from-eu,2020-03-18 00:00:00,0.3333333333333333,Germany closing its borders to travelers from EU | TheHill,https://thehill.com/policy/international/488310-germany-closing-its-borders-to-travelers-from-eu,closes+boarders,germany+closes+boarders,boarders,germany,German officials announced Wednesday that the country will ban travel from European Union (EU) countries as part of the country's efforts to,2020-03-18 00:00:00
53,"Coronavirus COVID-19; air borders with Spain, Italy,France, Germany and Austria;; (16 March – 15 April 2020) Coronavirus COVID-19; land borders with France ...",startpage,[4],https://ec.europa.eu/home-affairs/what[...]engen/reintroduction-border-control_en,,0.25,Temporary Reintroduction of Border Control - European Commission,https://ec.europa.eu/home-affairs/what-we-do/policies/borders-and-visas/schengen/reintroduction-border-control_en,closes+boarders,germany+closes+boarders,boarders,germany,"Coronavirus COVID-19; air borders with Spain, Italy,France, Germany and Austria;; (16 March – 15 April 2020) Coronavirus COVID-19; land borders with France",
54,"Germany Introduces Rigorous Border Checks as Coronavirus Precaution ... gathering spots, such as bars, restaurants and discos to close.",startpage,[5],https://www.schengenvisainfo.com/news/[...]cks-as-coronavirus-precaution-measure/,2020-02-29 00:00:00,0.2,Germany Introduces Rigorous Border Checks as Coronavirus ...,https://www.schengenvisainfo.com/news/germany-introduces-rigorous-border-checks-as-coronavirus-precaution-measure/,closes+boarders,germany+closes+boarders,boarders,germany,"Germany Introduces Rigorous Border Checks as Coronavirus Precaution gathering spots, such as bars, restaurants and discos to close.",2020-02-29 00:00:00
55,"Germany Switzerland S. Korea France USA Spain China Iran Italy 0 10 ... blanket travel bans and border closures in response to coronavirus, ...",startpage,[6],https://www.euronews.com/2020/03/09/co[...]omes-most-affected-country-after-china,2020-03-14 00:00:00,0.16666666666666666,Coronavirus: Spain declares state of emergency as France shuts ...,https://www.euronews.com/2020/03/09/coronavirus-italy-becomes-most-affected-country-after-china,closes+boarders,germany+closes+boarders,boarders,germany,"Germany Switzerland S. Korea France USA Spain China Iran Italy 0 10 blanket travel bans and border closures in response to coronavirus,",2020-03-14 00:00:00
56,"The German government is not considering closing the country's borders at the moment due to the coronavirus outbreak, a spokesman for the ...",startpage,[7],https://www.reuters.com/article/us-chi[...]irus-at-moment-spokesman-idUSKCN20I14S,2020-02-24 00:00:00,0.14285714285714285,Germany not considering closing borders due to coronavirus at ...,https://www.reuters.com/article/us-china-health-germany-ministry/germany-not-considering-closing-borders-due-to-coronavirus-at-moment-spokesman-idUSKCN20I14S,closes+boarders,germany+closes+boarders,boarders,germany,"The German government is not considering closing the country's borders at the moment due to the coronavirus outbreak, a spokesman for the",2020-02-24 00:00:00
57,"An open border is a border that enables free movement of people (and often of goods) between ... A closed border is a border that prevents movement of people between ... Austria, Denmark, France, Germany, Norway, and Sweden temporarily imposed controls on their borders due to the 2010– European migrant crisis.",startpage,[8],https://en.wikipedia.org/wiki/Open_border,,0.125,Open border - Wikipedia,https://en.wikipedia.org/wiki/Open_border,closes+boarders,germany+closes+boarders,boarders,germany,"An open border is a border that enables free movement of people (and often of goods) between A closed border is a border that prevents movement of people between Austria, Denmark, France, Germany, Norway, and Sweden temporarily imposed controls on their borders due to the 2010– European migrant crisis.",
58,"Today, six countries - Germany, France, Austria, Denmark, Sweden and Norway - still have temporary border controls to prevent irregular ...",startpage,[9],https://euobserver.com/coronavirus/147576,2020-02-28 00:00:00,0.1111111111111111,[Coronavirus] EU experts: closing borders 'ineffective' for coronavirus,https://euobserver.com/coronavirus/147576,closes+boarders,germany+closes+boarders,boarders,germany,"Today, six countries - Germany, France, Austria, Denmark, Sweden and Norway - still have temporary border controls to prevent irregular",2020-02-28 00:00:00
59,"As the cases spread and multiply, calls for closing borders have grown ... In what experts argue is an abuse of the rules, Germany, France, ...",startpage,[10],https://www.nytimes.com/2020/02/26/wor[...]europe/coronavirus-european-union.html,2020-02-26 00:00:00,0.1,Coronavirus Nightmare Could Be the End for Europe's Borderless ...,https://www.nytimes.com/2020/02/26/world/europe/coronavirus-european-union.html,closes+boarders,germany+closes+boarders,boarders,germany,"As the cases spread and multiply, calls for closing borders have grown In what experts argue is an abuse of the rules, Germany, France,",2020-02-26 00:00:00
60,08:00 German carmaker Volkswagen announced it would stop production at the vast majority of its factories in Germany and the rest of Europe ...,startpage,[1],https://www.dw.com/en/coronavirus-germ[...]mplements-non-eu-travel-ban/a-52802039,2020-03-17 00:00:00,1.0,Coronavirus: Germany implements non-EU travel ban | DW | 17.03 ...,https://www.dw.com/en/coronavirus-germany-implements-non-eu-travel-ban/a-52802039,Travel+ban,germany+Travel+ban,boarders,germany,08:00 German carmaker Volkswagen announced it would stop production at the vast majority of its factories in Germany and the rest of Europe,2020-03-17 00:00:00
61,"The European Union is locking down its borders, imposing a 30-day entry ban on nonessential travel for non-EU citizens to slow the spread of ...",startpage,[2],https://www.npr.org/sections/goatsands[...]en-restrictions-to-control-coronavirus,2020-03-17 00:00:00,0.5,"EU Locks Down Borders As France, Germany Tighten Restrictions ...",https://www.npr.org/sections/goatsandsoda/2020/03/17/816994811/eu-to-shut-borders-as-france-germany-tighten-restrictions-to-control-coronavirus,Travel+ban,germany+Travel+ban,boarders,germany,"The European Union is locking down its borders, imposing a 30-day entry ban on nonessential travel for non-EU citizens to slow the spread of",2020-03-17 00:00:00
62,"4 hours ago ... Foreigners travelling from Italy, Germany, Spain, France, Iran and the US were banned from entering Cambodia from March 17. Cameroon. On ...",startpage,[3],https://www.aljazeera.com/news/2020/03[...]shutdowns-country-200318091505922.html,,0.3333333333333333,"Coronavirus: Travel restrictions, border shutdowns by country ...",https://www.aljazeera.com/news/2020/03/coronavirus-travel-restrictions-border-shutdowns-country-200318091505922.html,Travel+ban,germany+Travel+ban,boarders,germany,2020-03-25,2020-03-25 00:00:00
63,"On Sunday, Germany moved to impose travel restrictions along most of its borders, without having informed Austria or other neighboring ...",startpage,[4],https://www.latimes.com/world-nation/s[...]6/eu-european-union-coronavirus-travel,2020-03-16 00:00:00,0.25,"EU considers sweeping travel ban, but it might be too late - Los ...",https://www.latimes.com/world-nation/story/2020-03-16/eu-european-union-coronavirus-travel,Travel+ban,germany+Travel+ban,boarders,germany,"On Sunday, Germany moved to impose travel restrictions along most of its borders, without having informed Austria or other neighboring",2020-03-16 00:00:00
64,"COVID-19 Exceptional Travel Advisory Notice. As countries respond to the COVID-19 pandemic, including travel and border restrictions, the FCO advises British ...",startpage,[5],https://www.gov.uk/foreign-travel-advice/germany,,0.2,Germany travel advice - GOV.UK,https://www.gov.uk/foreign-travel-advice/germany,Travel+ban,germany+Travel+ban,boarders,germany,"COVID-19 Exceptional Travel Advisory Notice. As countries respond to the COVID-19 pandemic, including travel and border restrictions, the FCO advises British",
65,"Many airports are closing, preventing flights from leaving. Exit bans are becoming more frequent. New restrictions may be imposed with little warning. Your travel ...",startpage,[6],https://travel.gc.ca/destinations/germany,,0.16666666666666666,Travel advice and advisories for Germany,https://travel.gc.ca/destinations/germany,Travel+ban,germany+Travel+ban,boarders,germany,"Many airports are closing, preventing flights from leaving. Exit bans are becoming more frequent. New restrictions may be imposed with little warning. Your travel",
66,,startpage,[7],https://www.thelocal.de/tag/travel+ban,,0.14285714285714285,Travel ban - The Local Germany,https://www.thelocal.de/tag/travel+ban,Travel+ban,germany+Travel+ban,boarders,germany,,
67,"How effective are travel bans against coronavirus spread? ... Denmark, Estonia, Finland, France, Germany, Greece, Hungary, Iceland, Italy, ...",startpage,[8],https://edition.cnn.com/travel/article/coronavirus-travel-bans/index.html,2020-03-21 00:36:41,0.125,Which countries have travel bans because of coronavirus outbreak ...,https://edition.cnn.com/travel/article/coronavirus-travel-bans/index.html,Travel+ban,germany+Travel+ban,boarders,germany,"How effective are travel bans against coronavirus spread? Denmark, Estonia, Finland, France, Germany, Greece, Hungary, Iceland, Italy,",2020-03-21 00:36:41
68,The German government has banned all gatherings of more than two ... COVID-19 crisis page on travel.state.gov · CDC page on COVID-19 ...,startpage,[9],https://de.usembassy.gov/covid-19-information/,2020-03-24 00:36:41,0.1111111111111111,COVID-19 Information | U.S. Embassy & Consulates in Germany,https://de.usembassy.gov/covid-19-information/,Travel+ban,germany+Travel+ban,boarders,germany,The German government has banned all gatherings of more than two COVID-19 crisis page on travel.state.gov · CDC page on COVID-19,2020-03-24 00:36:41
69,ALERT - COVID-19 - Do not travel overseas at this time. ... measures including travel restrictions and quarantine requirements to prevent the spread of the virus.,startpage,[10],https://www.safetravel.govt.nz/germany,,0.1,Germany | SafeTravel,https://www.safetravel.govt.nz/germany,Travel+ban,germany+Travel+ban,boarders,germany,ALERT - COVID-19 - Do not travel overseas at this time. measures including travel restrictions and quarantine requirements to prevent the spread of the virus.,
70,4 Mar 2020 ...,startpage,[1],https://www.thelocal.de/20200304/coron[...]-are-doing-to-reduce-risks-for-workers,,1.0,Recruitment freeze and home office: How coronavirus is affecting ...,https://www.thelocal.de/20200304/coronavirus-what-employers-in-germany-are-doing-to-reduce-risks-for-workers,home+office,germany+home+office,HomeOffice,germany,2020-03-04,2020-03-04 00:00:00
71,This site uses cookies in order to provide you with the best possible service.,startpage,[2],https://www.auswaertiges-amt.de/en,,0.5,German Federal Foreign Office,https://www.auswaertiges-amt.de/en,home+office,germany+home+office,HomeOffice,germany,This site uses cookies in order to provide you with the best possible service.,
72,"Latest travel advice for Germany including safety and security, entry requirements, ... money anywhere other than banks or legitimate currency exchange offices.",startpage,[3],https://www.gov.uk/foreign-travel-advice/germany,,0.3333333333333333,Germany travel advice - GOV.UK,https://www.gov.uk/foreign-travel-advice/germany,home+office,germany+home+office,HomeOffice,germany,"Latest travel advice for Germany including safety and security, entry requirements, money anywhere other than banks or legitimate currency exchange offices.",
73,"Home office stock photo (picture-alliance/dpa/C. Klose). Germany's Labor Ministry wants to require employers to allow staff to work from home, ...",startpage,[4],https://www.dw.com/en/a-german-right-t[...]k-from-home-in-your-pajamas/a-46964872,2019-01-04 00:00:00,0.25,A German right to work from home in your pajamas? | News | DW ...,https://www.dw.com/en/a-german-right-to-work-from-home-in-your-pajamas/a-46964872,home+office,germany+home+office,HomeOffice,germany,"Home office stock photo (picture-alliance/dpa/C. Klose). Germany's Labor Ministry wants to require employers to allow staff to work from home,",2019-01-04 00:00:00
74,"The Federal Ministry of the Interior, Building and Community abbreviated BMI, is a cabinet-level ministry of the Federal Republic of Germany. Its main office is in ...",startpage,[5],"https://en.wikipedia.org/wiki/Federal_[...]f_the_Interior,_Building_and_Community",,0.2,"Federal Ministry of the Interior, Building and Community - Wikipedia","https://en.wikipedia.org/wiki/Federal_Ministry_of_the_Interior,_Building_and_Community",home+office,germany+home+office,HomeOffice,germany,"The Federal Ministry of the Interior, Building and Community abbreviated BMI, is a cabinet-level ministry of the Federal Republic of Germany. Its main office is in",
75,2 days per week from home office (give or... Send. See. Save ...,startpage,[6],https://www.totaljobs.com/jobs/work-from-home/in-germany,,0.16666666666666666,Work From Home Jobs in Germany in March 2020 - Totaljobs,https://www.totaljobs.com/jobs/work-from-home/in-germany,home+office,germany+home+office,HomeOffice,germany,2020-03-24,2020-03-24 00:00:00
76,But it's not always that simple. The following is a brief overview of the legal situation in Germany. When is a home office a home office? The ...,startpage,[7],https://www.lexology.com/library/detai[...]g=14e60044-b933-4c9a-9d09-6e605c58f3ea,2019-04-08 00:00:00,0.14285714285714285,Mistakes and Myths about Home Offices and Mobile Working in ...,https://www.lexology.com/library/detail.aspx?g=14e60044-b933-4c9a-9d09-6e605c58f3ea,home+office,germany+home+office,HomeOffice,germany,But it's not always that simple. The following is a brief overview of the legal situation in Germany. When is a home office a home office? The,2019-04-08 00:00:00
77,"The Head Office of the DFG employs 850 members of staff and is based in Bonn. It has an office in Berlin plus foreign offices in India, Japan, Latin America, ...",startpage,[8],https://www.dfg.de/en/dfg_profile/head_office/index.jsp,,0.125,"DFG Head Office - DFG, German Research Foundation",https://www.dfg.de/en/dfg_profile/head_office/index.jsp,home+office,germany+home+office,HomeOffice,germany,"The Head Office of the DFG employs 850 members of staff and is based in Bonn. It has an office in Berlin plus foreign offices in India, Japan, Latin America,",
78,,startpage,[9],https://www.bundesregierung.de/breg-en,,0.1111111111111111,Home Page,https://www.bundesregierung.de/breg-en,home+office,germany+home+office,HomeOffice,germany,,
79,"Pandora's office in Hamburg, Germany, is the regional head office for Pandora in Northern Europe. From here, we manage the distribution of our Pandora ...",startpage,[10],https://pandoragroup.com/careers/pandora-in-your-region/germany,,0.1,Germany - Pandora Group,https://pandoragroup.com/careers/pandora-in-your-region/germany,home+office,germany+home+office,HomeOffice,germany,"Pandora's office in Hamburg, Germany, is the regional head office for Pandora in Northern Europe. From here, we manage the distribution of our Pandora",
80,"BERLIN (Reuters) - Schools and kindergartens will be shut in most German states until after the Easter holiday in April, a measure designed to ...",startpage,[1],https://www.usnews.com/news/world/arti[...]hools-to-slow-coronavirus-epidemic-dpa,2020-03-13 00:00:00,1.0,Germany to Shut Most Schools to Slow Coronavirus Spread | World ...,https://www.usnews.com/news/world/articles/2020-03-13/german-state-of-bavaria-closes-schools-to-slow-coronavirus-epidemic-dpa,schools+shut,germany+schools+shut,schools,germany,"BERLIN (Reuters) - Schools and kindergartens will be shut in most German states until after the Easter holiday in April, a measure designed to",2020-03-13 00:00:00
81,"The number of children, youth and adults not attending schools or universities because of COVID-19 is soaring. Governments all around the world have closed ...",startpage,[2],https://en.unesco.org/themes/education[...]mergencies/coronavirus-school-closures,,0.5,School closures caused by Coronavirus (Covid-19) - Unesco,https://en.unesco.org/themes/education-emergencies/coronavirus-school-closures,schools+shut,germany+schools+shut,schools,germany,"The number of children, youth and adults not attending schools or universities because of COVID-19 is soaring. Governments all around the world have closed",
82,"School Closures in Germany German States Move To Close Educational and Daycare Facilities. First Saarland and Bavaria, followed by Berlin ...",startpage,[3],https://www.spiegel.de/international/g[...]a-e9c13296-002b-484b-88bc-e14ea295ff10,2020-03-17 00:00:00,0.3333333333333333,School Closures in Germany: German States Move To Close ...,https://www.spiegel.de/international/germany/germany-states-move-to-close-educational-and-daycare-facilities-a-e9c13296-002b-484b-88bc-e14ea295ff10,schools+shut,germany+schools+shut,schools,germany,"School Closures in Germany German States Move To Close Educational and Daycare Facilities. First Saarland and Bavaria, followed by Berlin",2020-03-17 00:00:00
83,9 Mar 2020 ...,startpage,[4],https://www.thelocal.de/20200309/coron[...]days-is-closing-schools-the-right-call,,0.25,'Corona-Holidays': Is closing German schools over virus fears the ...,https://www.thelocal.de/20200309/corona-holidays-is-closing-schools-the-right-call,schools+shut,germany+schools+shut,schools,germany,2020-03-09,2020-03-09 00:00:00
84,17 Mar 2020 ...,startpage,[5],https://www.theguardian.com/education/[...]reduce-coronavirus-transmission-expert,,0.2,Shutting schools would reduce coronavirus transmission – expert,https://www.theguardian.com/education/2020/mar/17/shutting-schools-would-reduce-coronavirus-transmission-expert,schools+shut,germany+schools+shut,schools,germany,2020-03-17,2020-03-17 00:00:00
85,"Schools and kindergartens will be shut in most German states until after the Easter holiday in April, a measure designed to slow the spread of ...",startpage,[6],https://www.reuters.com/article/us-hea[...]coronavirus-epidemic-dpa-idUSKBN2100SA,2020-03-13 00:00:00,0.16666666666666666,Germany to shut most schools to slow coronavirus spread - Reuters,https://www.reuters.com/article/us-health-coronavirus-germany-schools/german-state-of-bavaria-closes-schools-to-slow-coronavirus-epidemic-dpa-idUSKBN2100SA,schools+shut,germany+schools+shut,schools,germany,"Schools and kindergartens will be shut in most German states until after the Easter holiday in April, a measure designed to slow the spread of",2020-03-13 00:00:00
86,16 Mar 2020 ...,startpage,[7],https://www.bbc.com/news/world-europe-51905129,,0.14285714285714285,Germany closes borders to try to slow virus,https://www.bbc.com/news/world-europe-51905129,schools+shut,germany+schools+shut,schools,germany,2020-03-16,2020-03-16 00:00:00
87,"Schools across Europe may be shut to prevent the spread of COVID-19, but pupils are still going to class — virtually. Led by trailblazers like ...",startpage,[8],https://www.dw.com/en/coronavirus-send[...]estonias-ready-germany-lags/a-52830864,2020-03-20 00:36:43,0.125,"Coronavirus sends class home — Estonia's ready, Germany lags ...",https://www.dw.com/en/coronavirus-sends-class-home-estonias-ready-germany-lags/a-52830864,schools+shut,germany+schools+shut,schools,germany,"Schools across Europe may be shut to prevent the spread of COVID-19, but pupils are still going to class — virtually. Led by trailblazers like",2020-03-20 00:36:43
88,"Schools are closing across the country, sports matchups have been suspended and almost everything is canceled. But some say Germany's ...",startpage,[9],https://www.dw.com/en/coronavirus-is-g[...]enough-to-slow-the-outbreak/a-52770782,2020-03-14 00:00:00,0.1111111111111111,Coronavirus: Is Germany doing enough to slow the outbreak? | DW ...,https://www.dw.com/en/coronavirus-is-germany-doing-enough-to-slow-the-outbreak/a-52770782,schools+shut,germany+schools+shut,schools,germany,"Schools are closing across the country, sports matchups have been suspended and almost everything is canceled. But some say Germany's",2020-03-14 00:00:00
