,content,engine,positions,pretty_url,pubdate,score,title,url,searchvalue,searchquery,ResponseCategory,country,contentDate,Date
0,"In addition to lockdown efforts, the German government has imposed a number of other restrictions on movement, including closing borders ...",startpage,[1],https://www.dw.com/en/germany-reports-[...]mpose-coronavirus-lockdowns/a-52871927,2020-03-22 00:36:33,1.0,Germany reports few violations as states impose coronavirus ...,https://www.dw.com/en/germany-reports-few-violations-as-states-impose-coronavirus-lockdowns/a-52871927,lockdown+imposes,germany+lockdown+imposes,lockdown,germany,"In addition to lockdown efforts, the German government has imposed a number of other restrictions on movement, including closing borders",2020-03-22 00:36:33
1,"IDF brings 30 sailors back from Germany after country imposes lockdown. Navy troops, who had been preparing for acquisition of Sa'ar 6 ...",startpage,[2],https://www.timesofisrael.com/idf-brin[...]ermany-after-country-imposes-lockdown/,2020-03-23 00:36:33,0.5,IDF brings 30 sailors back from Germany after country imposes ...,https://www.timesofisrael.com/idf-brings-30-sailors-back-from-germany-after-country-imposes-lockdown/,lockdown+imposes,germany+lockdown+imposes,lockdown,germany,"IDF brings 30 sailors back from Germany after country imposes lockdown. Navy troops, who had been preparing for acquisition of Sa'ar 6",2020-03-23 00:36:33
2,5 days ago ...,startpage,[3],https://www.thelocal.de/20200320/bavar[...]-first-german-state-to-impose-lockdown,,0.3333333333333333,UPDATE: Bavaria and Saarland become first German states to ...,https://www.thelocal.de/20200320/bavaria-becomes-first-german-state-to-impose-lockdown,lockdown+imposes,germany+lockdown+imposes,lockdown,germany,2020-03-21,2020-03-21 00:00:00
3,5 days ago ...,startpage,[4],https://www.independent.co.uk/news/wor[...]own-today-bavaria-latest-a9413746.html,,0.25,Coronavirus: Germany introduces first lockdown as Bavaria imposes ...,https://www.independent.co.uk/news/world/europe/coronavirus-germany-update-lockdown-today-bavaria-latest-a9413746.html,lockdown+imposes,germany+lockdown+imposes,lockdown,germany,2020-03-21,2020-03-21 00:00:00
4,France toughens its lockdown France has again tightened the rules ... Germany has responded to the rapid spread of the virus by imposing a ...,startpage,[5],https://www.ft.com/content/4ac1266a-436d-3128-b068-2d68ddc1485c,2020-03-25 00:36:33,0.2,Coronavirus: France's death toll tops 1000 – as it happened,https://www.ft.com/content/4ac1266a-436d-3128-b068-2d68ddc1485c,lockdown+imposes,germany+lockdown+imposes,lockdown,germany,France toughens its lockdown France has again tightened the rules Germany has responded to the rapid spread of the virus by imposing a,2020-03-25 00:36:33
5,"The small Bavarian town of Mitterteich, the first in Germany to go into total lockdown over the spiraling coronavirus outbreak.",startpage,[6],https://www.thejakartapost.com/news/20[...]n-germany-to-impose-full-lockdown.html,2020-03-20 00:36:33,0.16666666666666666,Bavarian town is first in Germany to impose full lockdown - World ...,https://www.thejakartapost.com/news/2020/03/20/bavarian-town-is-first-in-germany-to-impose-full-lockdown.html,lockdown+imposes,germany+lockdown+imposes,lockdown,germany,"The small Bavarian town of Mitterteich, the first in Germany to go into total lockdown over the spiraling coronavirus outbreak.",2020-03-20 00:36:33
6,"Coronavirus: National shutdown looms in Germany as Bavaria imposes total lockdown. Jill Petzinger. Jill Petzinger, Germany Correspondent, ...",startpage,[7],https://uk.finance.yahoo.com/news/coro[...]-imposes-total-lockdown-125154692.html,2020-03-21 00:36:33,0.14285714285714285,Coronavirus: National shutdown looms in Germany as Bavaria ...,https://uk.finance.yahoo.com/news/coronavirus-national-shutdown-looms-in-germany-as-bavaria-imposes-total-lockdown-125154692.html,lockdown+imposes,germany+lockdown+imposes,lockdown,germany,"Coronavirus: National shutdown looms in Germany as Bavaria imposes total lockdown. Jill Petzinger. Jill Petzinger, Germany Correspondent,",2020-03-21 00:36:33
7,4 days ago ...,startpage,[8],https://www.express.co.uk/news/world/1[...]kdown-EU-Italy-Spain-BBC-Angela-Merkel,,0.125,Germany's crisis lockdown: BBC claim Merkel will shut down EU's ...,https://www.express.co.uk/news/world/1258438/Germany-crisis-coronavirus-lockdown-EU-Italy-Spain-BBC-Angela-Merkel,lockdown+imposes,germany+lockdown+imposes,lockdown,germany,2020-03-22,2020-03-22 00:00:00
8,1 day ago ...,startpage,[9],https://www.theguardian.com/world/live[...]cases-meetings-bans-update-latest-news,,0.1111111111111111,WHO warns global spread of virus is accelerating – as it happened,https://www.theguardian.com/world/live/2020/mar/23/coronavirus-live-updates-uk-us-italy-germany-europe-outbreak-cases-meetings-bans-update-latest-news,lockdown+imposes,germany+lockdown+imposes,lockdown,germany,2020-03-25,2020-03-25 00:00:00
9,5 days ago ...,startpage,[10],https://www.iamexpat.de/expat-info/ger[...]ws/bavaria-imposes-state-wide-lockdown,,0.1,Bavaria imposes state-wide lockdown,https://www.iamexpat.de/expat-info/german-expat-news/bavaria-imposes-state-wide-lockdown,lockdown+imposes,germany+lockdown+imposes,lockdown,germany,2020-03-21,2020-03-21 00:00:00
10,"Italy's decision to quarantine a quarter of its population is sending tremors ... of the virus spiking to more than 1,000 in France and 900 in Germany, ... on the export of protective medical gear, which they imposed to head off ...",startpage,[1],https://www.nytimes.com/2020/03/08/world/europe/coronavirus-europe.html,2020-03-08 00:00:00,1.0,"Europe, With Eye on Italy Coronavirus Quarantine, Plans Next ...",https://www.nytimes.com/2020/03/08/world/europe/coronavirus-europe.html,quarantin+impose,germany+quarantin+impose,lockdown,germany,"Italy's decision to quarantine a quarter of its population is sending tremors of the virus spiking to more than 1,000 in France and 900 in Germany, on the export of protective medical gear, which they imposed to head off",2020-03-08 00:00:00
11,13 Mar 2020 ...,startpage,[2],https://www.iamexpat.de/expat-info/ger[...]ricting-travel-germany-due-coronavirus,,0.5,Which countries are restricting travel from Germany due to ...,https://www.iamexpat.de/expat-info/german-expat-news/which-countries-are-restricting-travel-germany-due-coronavirus,quarantin+impose,germany+quarantin+impose,lockdown,germany,2020-03-13,2020-03-13 00:00:00
12,Italy imposes region-wide coronavirus quarantine in Lombardy ... Read more: Coronavirus in Germany: Health care system under pressure.,startpage,[3],https://www.dw.com/en/italy-imposes-re[...]irus-quarantine-in-lombardy/a-52679158,2020-03-07 00:00:00,0.3333333333333333,Italy imposes region-wide coronavirus quarantine in Lombardy | DW ...,https://www.dw.com/en/italy-imposes-region-wide-coronavirus-quarantine-in-lombardy/a-52679158,quarantin+impose,germany+quarantin+impose,lockdown,germany,Italy imposes region-wide coronavirus quarantine in Lombardy Read more: Coronavirus in Germany: Health care system under pressure.,2020-03-07 00:00:00
13,"Coronavirus: Merkel goes into quarantine as Germany imposes extreme ... Jill Petzinger, Germany Correspondent, Yahoo Finance UK.",startpage,[4],https://finance.yahoo.com/news/coronav[...]-restrictions-on-public-175932312.html,2020-03-23 00:36:34,0.25,Coronavirus: Germany orders extreme restrictions on public life,https://finance.yahoo.com/news/coronavirus-merkel-goes-into-quarantine-as-germany-imposes-extreme-restrictions-on-public-175932312.html,quarantin+impose,germany+quarantin+impose,lockdown,germany,"Coronavirus: Merkel goes into quarantine as Germany imposes extreme Jill Petzinger, Germany Correspondent, Yahoo Finance UK.",2020-03-23 00:36:34
14,"German Chancellor Angela Merkel went into quarantine on Sunday after ... making sure to impose the same rules in principle across Germany,” ...",startpage,[5],https://www.thehindu.com/news/internat[...]th-infected-doctor/article31137970.ece,2020-03-23 00:36:34,0.2,Coronavirus | Germany's Merkel goes into quarantine after contact ...,https://www.thehindu.com/news/international/coronavirus-germanys-merkel-goes-into-quarantine-after-contact-with-infected-doctor/article31137970.ece,quarantin+impose,germany+quarantin+impose,lockdown,germany,"German Chancellor Angela Merkel went into quarantine on Sunday after making sure to impose the same rules in principle across Germany,”",2020-03-23 00:36:34
15,10 Mar 2020 ...,startpage,[6],https://www.thelocal.de/20200310/trave[...]ny-barred-from-entering-some-countries,,0.16666666666666666,These are the countries banning or restricting travel from Germany,https://www.thelocal.de/20200310/travelers-from-germany-barred-from-entering-some-countries,quarantin+impose,germany+quarantin+impose,lockdown,germany,2020-03-10,2020-03-10 00:00:00
16,"Macau imposes quarantine on arrivals from Japan, Germany, France, Spain (Update). 9 Mar, 2020. # Social Affairs, #Tourism ...",startpage,[7],https://macaunews.mo/macau-imposes-qua[...]ivals-from-japan-germany-france-spain/,2020-03-09 00:00:00,0.14285714285714285,"Macau imposes quarantine on arrivals from Japan, Germany ...",https://macaunews.mo/macau-imposes-quarantine-on-arrivals-from-japan-germany-france-spain/,quarantin+impose,germany+quarantin+impose,lockdown,germany,"Macau imposes quarantine on arrivals from Japan, Germany, France, Spain (Update). 9 Mar, 2020. # Social Affairs, #Tourism",2020-03-09 00:00:00
17,Germany tightened border checks and urged the cancellation of major events as authorities across Europe took action to contain the ...,startpage,[8],https://www.bloomberg.com/news/article[...]rantines-to-contain-coronavirus-spread,2020-02-28 00:00:00,0.125,Coronavirus News: Germany Steps Up Quarantines to Contain ...,https://www.bloomberg.com/news/articles/2020-02-28/germany-steps-up-quarantines-to-contain-coronavirus-spread,quarantin+impose,germany+quarantin+impose,lockdown,germany,Germany tightened border checks and urged the cancellation of major events as authorities across Europe took action to contain the,2020-02-28 00:00:00
18,... Hong Kong from all of Italy; Bourgogne-Franche-Comté and Grand Est in France; North Rhine-Westphalia in Germany; and Hokkaido in Japan.,startpage,[9],https://www.scmp.com/news/hong-kong/po[...]ng-planning-extend-travel-restrictions,2020-03-10 00:00:00,0.1111111111111111,Hong Kong to quarantine arrivals from Italy and parts of France ...,https://www.scmp.com/news/hong-kong/politics/article/3074380/coronavirus-hong-kong-planning-extend-travel-restrictions,quarantin+impose,germany+quarantin+impose,lockdown,germany,... Hong Kong from all of Italy; Bourgogne-Franche-Comté and Grand Est in France; North Rhine-Westphalia in Germany; and Hokkaido in Japan.,2020-03-10 00:00:00
19,"... start imposing travel restrictions and quarantine rules on arrivals from ... Germany and France have each recorded more than 1,100 infections ...",startpage,[10],https://www.scmp.com/news/hong-kong/po[...]kong-should-impose-travel-restrictions,2020-03-09 00:00:00,0.1,Coronavirus: Hong Kong urged to get tough on travel controls for ...,https://www.scmp.com/news/hong-kong/politics/article/3074213/coronavirus-hong-kong-should-impose-travel-restrictions,quarantin+impose,germany+quarantin+impose,lockdown,germany,"... start imposing travel restrictions and quarantine rules on arrivals from Germany and France have each recorded more than 1,100 infections",2020-03-09 00:00:00
20,16 Mar 2020 ...,startpage,[1],https://www.thelocal.de/20200316/germa[...]y-orders-closer-of-non-essential-shops,,1.0,Coronavirus: Germany orders closure of non-essential shops and ...,https://www.thelocal.de/20200316/germany-orders-closer-of-non-essential-shops,shutdown+shops,germany+shutdown+shops,lockdown,germany,2020-03-16,2020-03-16 00:00:00
21,"Coronavirus: Merkel announces sweeping shutdown in Germany ... that will be allowed to stay open include supermarkets, beverage shops, ...",startpage,[2],https://uk.finance.yahoo.com/news/merk[...]slow-coronavirus-spread-173908708.html,2020-03-16 00:00:00,0.5,Coronavirus: Merkel announces Germany shutdown of all but ...,https://uk.finance.yahoo.com/news/merkel-announces-sweeping-shutdown-of-all-but-essential-shops-to-slow-coronavirus-spread-173908708.html,shutdown+shops,germany+shutdown+shops,lockdown,germany,"Coronavirus: Merkel announces sweeping shutdown in Germany that will be allowed to stay open include supermarkets, beverage shops,",2020-03-16 00:00:00
22,Supermarkets and other shops that provide basic goods that are necessary for daily life will be allowed to stay open. Also excluded from ...,startpage,[3],https://www.spiegel.de/international/g[...]a-093655fd-386f-40b6-af01-e24a8cb02f6a,2020-03-16 00:00:00,0.3333333333333333,Drastic Measures: Germany Moves To Shut Down Most of Public Life,https://www.spiegel.de/international/germany/germany-moves-to-shut-down-most-of-public-life-a-093655fd-386f-40b6-af01-e24a8cb02f6a,shutdown+shops,germany+shutdown+shops,lockdown,germany,Supermarkets and other shops that provide basic goods that are necessary for daily life will be allowed to stay open. Also excluded from,2020-03-16 00:00:00
23,"In the Federal Republic of Germany, the Ladenschlussgesetz or ""Shop Closing Law"" (abbreviated: LadSchlG) is the federal law regulating at which times retail ...",startpage,[4],https://en.wikipedia.org/wiki/Ladenschlussgesetz,,0.25,Ladenschlussgesetz - Wikipedia,https://en.wikipedia.org/wiki/Ladenschlussgesetz,shutdown+shops,germany+shutdown+shops,lockdown,germany,"In the Federal Republic of Germany, the Ladenschlussgesetz or ""Shop Closing Law"" (abbreviated: LadSchlG) is the federal law regulating at which times retail",
24,"With Germans snapping up canned goods and toilet paper to weather the outbreak, stores have fewer supplies left over to donate to the needy, ...",startpage,[5],https://www.dw.com/en/coronavirus-begi[...]-public-life-across-germany/a-52743358,2020-03-12 00:00:00,0.2,Coronavirus begins shutting down public life across Germany | DW ...,https://www.dw.com/en/coronavirus-begins-shutting-down-public-life-across-germany/a-52743358,shutdown+shops,germany+shutdown+shops,lockdown,germany,"With Germans snapping up canned goods and toilet paper to weather the outbreak, stores have fewer supplies left over to donate to the needy,",2020-03-12 00:00:00
25,16 Mar 2020 ...,startpage,[6],https://www.dailymail.co.uk/news/artic[...]s-new-rules-close-essential-shops.html,,0.16666666666666666,Coronavirus Germany: All but banks and essential shops closed,https://www.dailymail.co.uk/news/article-8117883/Germany-agrees-new-rules-close-essential-shops.html,shutdown+shops,germany+shutdown+shops,lockdown,germany,2020-03-16,2020-03-16 00:00:00
26,"Many ski resorts and hotels across Europe are also closing their doors. ... Supermarkets and pharmacies remain open–other shops are required to close ... As are Chinese, South Koreans and Germans from all other regions.",startpage,[7],https://www.forbes.com/sites/tamarathi[...]avirus-europe-closes-borders-tourists/,2020-03-14 00:00:00,0.14285714285714285,Coronavirus: Some Of These 24 European Countries Have Closed ...,https://www.forbes.com/sites/tamarathiessen/2020/03/14/coronavirus-europe-closes-borders-tourists/,shutdown+shops,germany+shutdown+shops,lockdown,germany,"Many ski resorts and hotels across Europe are also closing their doors. Supermarkets and pharmacies remain open–other shops are required to close As are Chinese, South Koreans and Germans from all other regions.",2020-03-14 00:00:00
27,"Germany's chancellor Angela Merkel this week announced a shutdown of shops, churches, sports facilities, bars and clubs, while imposing ...",startpage,[8],https://www.ft.com/content/79d19c62-1396-3763-8b42-aaf1f091e336,2020-03-17 00:00:00,0.125,Coronavirus: US exchanges argue against shortened trading hours ...,https://www.ft.com/content/79d19c62-1396-3763-8b42-aaf1f091e336,shutdown+shops,germany+shutdown+shops,lockdown,germany,"Germany's chancellor Angela Merkel this week announced a shutdown of shops, churches, sports facilities, bars and clubs, while imposing",2020-03-17 00:00:00
28,"Germany's draconian Ladenschlussgesetz (store-closing law) had no major revisions until October 1989 with the introduction of the “long Thursday,” der lange ...",startpage,[9],https://www.german-way.com/travel-and-[...]-in-germany/shopping-hours-in-germany/,,0.1111111111111111,Shopping Hours in Germany – The German Way & More,https://www.german-way.com/travel-and-tourism/germany-for-tourists/shopping-in-germany/shopping-hours-in-germany/,shutdown+shops,germany+shutdown+shops,lockdown,germany,"Germany's draconian Ladenschlussgesetz (store-closing law) had no major revisions until October 1989 with the introduction of the “long Thursday,” der lange",
29,"The prime minister closed all nonessential shops, banning meetings of more ... place Britain under a virtual lockdown, closing all nonessential shops, ... Chancellor Angela Merkel of Germany, who have all but quarantined ...",startpage,[10],https://www.nytimes.com/2020/03/23/wor[...]rope/coronavirus-uk-boris-johnson.html,2020-03-24 00:36:36,0.1,Coronavirus in the U.K.: Boris Johnson Orders Virtual Lockdown ...,https://www.nytimes.com/2020/03/23/world/europe/coronavirus-uk-boris-johnson.html,shutdown+shops,germany+shutdown+shops,lockdown,germany,"The prime minister closed all nonessential shops, banning meetings of more place Britain under a virtual lockdown, closing all nonessential shops, Chancellor Angela Merkel of Germany, who have all but quarantined",2020-03-24 00:36:36
30,"As restaurants and other services shut down on Monday, the ... by Germany's influential Ifo think tank, a partial economic shutdown could cost ...",startpage,[1],https://www.dw.com/en/coronavirus-germ[...]-costs-of-economic-shutdown/a-52890813,2020-03-24 00:36:37,1.0,Coronavirus: Germany counts costs of economic shutdown | DW ...,https://www.dw.com/en/coronavirus-germany-counts-costs-of-economic-shutdown/a-52890813,shut+down,germany+shut+down,lockdown,germany,"As restaurants and other services shut down on Monday, the by Germany's influential Ifo think tank, a partial economic shutdown could cost",2020-03-24 00:36:37
31,German authorities are turning visitors back at the airports amid the COVID-19 pandemic. Angela Merkel has urged Germans to rise to the ...,startpage,[2],https://www.dw.com/en/coronavirus-germ[...]n-borders-halts-public-life/a-52813432,2020-03-18 00:00:00,0.5,"Coronavirus: Germany shuts down borders, halts public life | DW ...",https://www.dw.com/en/coronavirus-germany-shuts-down-borders-halts-public-life/a-52813432,shut+down,germany+shut+down,lockdown,germany,German authorities are turning visitors back at the airports amid the COVID-19 pandemic. Angela Merkel has urged Germans to rise to the,2020-03-18 00:00:00
32,16 Mar 2020 ...,startpage,[3],https://www.bbc.com/news/world-europe-51905129,,0.3333333333333333,Germany closes borders to try to slow virus,https://www.bbc.com/news/world-europe-51905129,shut+down,germany+shut+down,lockdown,germany,2020-03-16,2020-03-16 00:00:00
33,"Following the March 2011 Fukushima nuclear disaster, Germany has permanently shut down eight of its 17 reactors. Galvanised by the ...",startpage,[4],https://en.wikipedia.org/wiki/Nuclear_power_phase-out,,0.25,Nuclear power phase-out - Wikipedia,https://en.wikipedia.org/wiki/Nuclear_power_phase-out,shut+down,germany+shut+down,lockdown,germany,"Following the March 2011 Fukushima nuclear disaster, Germany has permanently shut down eight of its 17 reactors. Galvanised by the",
34,BERLIN — The German government on Thursday banned two clubs linked to an anti-Semitic movement that refuses to recognize the modern ...,startpage,[5],https://www.nytimes.com/2020/03/19/wor[...]europe/germany-reich-citizens-ban.html,2020-03-20 00:36:37,0.2,Germany Shuts Down Far-Right Clubs That Deny the Modern State ...,https://www.nytimes.com/2020/03/19/world/europe/germany-reich-citizens-ban.html,shut+down,germany+shut+down,lockdown,germany,BERLIN — The German government on Thursday banned two clubs linked to an anti-Semitic movement that refuses to recognize the modern,2020-03-20 00:36:37
35,"This week, serious restrictions on public life go into effect across Germany. Many states have closed schools, cinemas, public swimming pools ...",startpage,[6],https://www.spiegel.de/international/g[...]a-3c541d1d-1d42-4672-9fdc-af6c3247df76,2020-03-16 00:00:00,0.16666666666666666,"Closures, Controls and Other Restrictions: The Shutdown Begins ...",https://www.spiegel.de/international/germany/the-shutdown-begins-across-germany-a-3c541d1d-1d42-4672-9fdc-af6c3247df76,shut+down,germany+shut+down,lockdown,germany,"This week, serious restrictions on public life go into effect across Germany. Many states have closed schools, cinemas, public swimming pools",2020-03-16 00:00:00
36,Drastic Measures Germany Moves To Shut Down Most of Public Life. The German government and the federal states have agreed to severe ...,startpage,[7],https://www.spiegel.de/international/g[...]a-093655fd-386f-40b6-af01-e24a8cb02f6a,2020-03-16 00:00:00,0.14285714285714285,Drastic Measures: Germany Moves To Shut Down Most of Public Life,https://www.spiegel.de/international/germany/germany-moves-to-shut-down-most-of-public-life-a-093655fd-386f-40b6-af01-e24a8cb02f6a,shut+down,germany+shut+down,lockdown,germany,Drastic Measures Germany Moves To Shut Down Most of Public Life. The German government and the federal states have agreed to severe,2020-03-16 00:00:00
37,"Italy Struck by Deadliest Day as Virus Prompts Industry Shutdown. By ... Germany, long a holdout on deficit spending, pledged new debt worth ...",startpage,[8],https://www.bloomberg.com/news/article[...]-spending-of-eu150-billion-scholz-says,2020-03-22 00:36:37,0.125,Virus News: Italian Industry Shuts Down - Bloomberg,https://www.bloomberg.com/news/articles/2020-03-21/germany-plans-extra-spending-of-eu150-billion-scholz-says,shut+down,germany+shut+down,lockdown,germany,"Italy Struck by Deadliest Day as Virus Prompts Industry Shutdown. By Germany, long a holdout on deficit spending, pledged new debt worth",2020-03-22 00:36:37
38,"Schools had already been shut down, but Chancellor Angela Merkel on Monday ordered a ban on religious services and the closing of most ...",startpage,[9],https://www.npr.org/sections/goatsands[...]en-restrictions-to-control-coronavirus,2020-03-17 00:00:00,0.1111111111111111,"EU Locks Down Borders As France, Germany Tighten Restrictions ...",https://www.npr.org/sections/goatsandsoda/2020/03/17/816994811/eu-to-shut-borders-as-france-germany-tighten-restrictions-to-control-coronavirus,shut+down,germany+shut+down,lockdown,germany,"Schools had already been shut down, but Chancellor Angela Merkel on Monday ordered a ban on religious services and the closing of most",2020-03-17 00:00:00
39,"ON. German nuclear power units. Plant, Type, MWe (net), Commercial operation, Operator, Provisionally scheduled shutdown 2001 ...",startpage,[10],https://www.world-nuclear.org/informat[...]ry-profiles/countries-g-n/germany.aspx,,0.1,Nuclear Power in Germany - World Nuclear Association,https://www.world-nuclear.org/information-library/country-profiles/countries-g-n/germany.aspx,shut+down,germany+shut+down,lockdown,germany,"ON. German nuclear power units. Plant, Type, MWe (net), Commercial operation, Operator, Provisionally scheduled shutdown 2001",
40,Travelers should be prepared for the possibility that additional travel restrictions will be implemented with little or no advance notice. The most ...,startpage,[1],https://de.usembassy.gov/covid-19-information/,2020-03-24 00:36:38,1.0,COVID-19 Information | U.S. Embassy & Consulates in Germany,https://de.usembassy.gov/covid-19-information/,travel+restrictions,germany+travel+restrictions,boarders,germany,Travelers should be prepared for the possibility that additional travel restrictions will be implemented with little or no advance notice. The most,2020-03-24 00:36:38
41,"EU leaders agree to implement a 30-day travel ban on those traveling from outside the EU, with a limited number of exceptions. German ...",startpage,[2],https://www.dw.com/en/coronavirus-late[...]mplements-non-eu-travel-ban/a-52802039,2020-03-17 00:00:00,0.5,Coronavirus latest: Germany implements non-EU travel ban | DW ...,https://www.dw.com/en/coronavirus-latest-germany-implements-non-eu-travel-ban/a-52802039,travel+restrictions,germany+travel+restrictions,boarders,germany,"EU leaders agree to implement a 30-day travel ban on those traveling from outside the EU, with a limited number of exceptions. German",2020-03-17 00:00:00
42,"The European Union is locking down its borders, imposing a 30-day entry ban on nonessential travel for non-EU citizens to slow the spread of ...",startpage,[3],https://www.npr.org/sections/goatsands[...]en-restrictions-to-control-coronavirus,2020-03-17 00:00:00,0.3333333333333333,"EU Locks Down Borders As France, Germany Tighten Restrictions ...",https://www.npr.org/sections/goatsandsoda/2020/03/17/816994811/eu-to-shut-borders-as-france-germany-tighten-restrictions-to-control-coronavirus,travel+restrictions,germany+travel+restrictions,boarders,germany,"The European Union is locking down its borders, imposing a 30-day entry ban on nonessential travel for non-EU citizens to slow the spread of",2020-03-17 00:00:00
